{
  "$schema": "../../../schema/json/starter.schema.json",
  "format": 1,
  "type": "starter",
  "id": "core/explorer",
  "title": "Explorer",
  "creator": "core",
  "starter": {
    "name": "Explorer",
    "summary": "Sharp senses and good luck. At home in old places.",
    "attributes": {
      "carry": 0,
      "senses": 2,
      "agility": 1,
      "luck": 2,
      "stamina": 1
    },
    "sprite": "core/base-kit:chars/player_down"
  }
}
